{"type":"config","name":"streaming-throughput","metricName":"throughput","metricUnit":"events/sec","bestDirection":"higher","maxExperiments":200}
{"commit":"2ba3ded","metric":57823,"status":"keep","description":"baseline: naive single-threaded, Instant.parse, String.split, ArrayList percentiles","metrics":{},"timestamp":1773548163}
{"commit":"4ea38d0","metric":199282,"status":"keep","description":"indexOf parsing, manual ISO timestamp, StringBuilder output, double[] sliding state","metrics":{},"timestamp":1773548426}
{"commit":"8ffd82d","metric":227588,"status":"keep","description":"single sort for both p50/p99 percentiles","metrics":{},"timestamp":1773548497}
{"commit":"8cb0763","metric":236966,"status":"keep","description":"1MB reader buffer + sensor ID interning via HashMap","metrics":{},"timestamp":1773548561}
{"commit":"4762190","metric":244953,"status":"keep","description":"quickselect O(n) for percentiles instead of full sort O(n log n)","metrics":{},"timestamp":1773548643}
{"commit":"b9a99ca","metric":240853,"status":"discard","description":"fast manual double parser (no improvement, within noise)","metrics":{},"timestamp":1773548720}
{"commit":"fd18f93","metric":270233,"status":"keep","description":"compact SensorWindow key (no type string), separate emitted sets, fast double parser","metrics":{},"timestamp":1773548865}
{"commit":"5eb423e","metric":328558,"status":"keep","description":"array-indexed windows replacing HashMaps entirely","metrics":{},"timestamp":1773549003}
{"commit":"9ee011b","metric":357935,"status":"keep","description":"bounded scan with floor/ceiling in emitReadyWindows","metrics":{},"timestamp":1773549130}
{"commit":"c8abfcd","metric":1155401,"status":"keep","description":"emit every 100K instead of 10K (massive 3.2x improvement)","metrics":{},"timestamp":1773549157}
{"commit":"4bc702a","metric":1422879,"status":"keep","description":"emit only at end, no intermediate emissions","metrics":{},"timestamp":1773549221}
{"commit":"27d48e1","metric":1857700,"status":"keep","description":"direct sensor index from digits, eliminates HashMap lookup","metrics":{},"timestamp":1773549270}
{"commit":"27d48e1","metric":1851508,"status":"discard","description":"memory-mapped I/O with byte-level parsing (no improvement vs BufferedReader)","metrics":{},"timestamp":1773549337}
{"commit":"78db04d","metric":2683123,"status":"keep","description":"multi-threaded parallel chunk processing with byte[] parsing","metrics":{},"timestamp":1773549411}
{"commit":"78db04d","metric":2670940,"status":"discard","description":"independent file handles per thread (no improvement)","metrics":{},"timestamp":1773549464}
{"commit":"78db04d","metric":2598752,"status":"discard","description":"simplified sliding window loop (no improvement)","metrics":{},"timestamp":1773549509}
{"commit":"78db04d","metric":2588661,"status":"discard","description":"pre-allocate sensor rows + hoist sRow (no improvement, memory waste)","metrics":{},"timestamp":1773549594}
{"commit":"78db04d","metric":2590673,"status":"discard","description":"fixed-offset parsing (JIT already optimizes comma scan)","metrics":{},"timestamp":1773549643}
{"commit":"78db04d","metric":2551671,"status":"discard","description":"smaller initial SlidingState array (more resizes, no gain)","metrics":{},"timestamp":1773549687}
{"commit":"3135919","metric":3480682,"status":"keep","description":"parallel merge+emit by sensor range","metrics":{},"timestamp":1773549746}
{"commit":"3135919","metric":3107520,"status":"discard","description":"Arrays.parallelSort slower for ~30K results","metrics":{},"timestamp":1773549772}
{"commit":"3135919","metric":2847380,"status":"discard","description":"BufferedWriter output slower than StringBuilder+print","metrics":{},"timestamp":1773549797}
{"commit":"3135919","metric":2983293,"status":"discard","description":"sorted-order emit but lost parallelism in merge+percentiles","metrics":{},"timestamp":1773549837}
{"commit":"3135919","metric":3356831,"status":"discard","description":"Arrays.sort in-place for percentiles (within noise)","metrics":{},"timestamp":1773549932}
{"commit":"3135919","metric":2398656,"status":"discard","description":"JVM flags -Xmx4g -XX:+UseZGC (slower, ZGC overhead)","metrics":{},"timestamp":1773549997}
{"commit":"3135919","metric":3468609,"status":"discard","description":"sorted SlidingState with O(n+m) merge (no improvement over quickselect)","metrics":{},"timestamp":1773550035}
{"commit":"3135919","metric":3378378,"status":"discard","description":"bounded minute ranges in merge (branch predictor already handles null checks)","metrics":{},"timestamp":1773550142}
{"commit":"3135919","metric":3478260,"status":"discard","description":"bucket-sorted emission + in-place percentiles (no improvement, within noise)","metrics":{},"timestamp":1773550700}
{"commit":"3135919","metric":3430531,"status":"discard","description":"per-minute value storage for sliding windows (concatenation overhead negated savings)","metrics":{},"timestamp":1773550822}
{"commit":"3135919","metric":3449465,"status":"discard","description":"flat-indexed output arrays (cache-unfriendly writes to minute-major layout)","metrics":{},"timestamp":1773551229}
{"commit":"3135919","metric":3378378,"status":"discard","description":"zero-alloc percentiles + direct byte output (byte loop slower than StringBuilder)","metrics":{},"timestamp":1773551346}
{"commit":"3135919","metric":3154574,"status":"discard","description":"double[8] sliding arrays + in-place percentiles (10% worse, too many resizes)","metrics":{},"timestamp":1773551520}
{"commit":"3135919","metric":3318951,"status":"discard","description":"bounded merge ranges + combined merge (code overhead exceeds iteration savings)","metrics":{},"timestamp":1773551751}
{"commit":"3135919","metric":2155172,"status":"discard","description":"single-partition processing (eliminate merge): 38% slower, sequential parsing bottleneck","metrics":{},"timestamp":1773552313}
{"commit":"3135919","metric":3035822,"status":"discard","description":"pre-sorted sliding + merge-sort merge: 13% slower, sort+alloc overhead exceeds quickselect savings","metrics":{},"timestamp":1773552413}
{"commit":"3135919","metric":3954132,"status":"keep","description":"sorted-order emit (no Collections.sort), parallel pct computation (3954132 ev/s, +13.6%)","metrics":{},"timestamp":1773552544}
{"commit":"107feb3","metric":3548616,"status":"discard","description":"byte[] output buffer with Long.toString().getBytes(): 10% slower, alloc overhead","metrics":{},"timestamp":1773552623}
{"commit":"107feb3","metric":4327131,"status":"keep","description":"parallel emit by minute range + BufferedOutputStream (4327131 ev/s, +9.4%)","metrics":{},"timestamp":1773552726}
{"commit":"8d5211c","metric":4504504,"status":"keep","description":"optimized sliding window loop: int minute iteration, no modulo, no redundant checks (4504504 ev/s, +4.1%)","metrics":{},"timestamp":1773552865}
{"commit":"33db179","metric":27322404,"status":"crash","description":"fixed-offset comma: CORRECTNESS FAIL, sliding window minute calc wrong","metrics":{},"timestamp":1773552959}
{"commit":"33db179","metric":27173913,"status":"crash","description":"fixed-offset comma (corrected): still CORRECTNESS FAIL, sliding window bug","metrics":{},"timestamp":1773553033}
{"commit":"33db179","metric":4498425,"status":"discard","description":"fixed-offset first comma (Z-aware): no improvement, within noise","metrics":{},"timestamp":1773553102}
{"commit":"33db179","metric":4928536,"status":"keep","description":"parallel byte[] conversion in emit threads (4928536 ev/s, +9.4%)","metrics":{},"timestamp":1773553210}
{"commit":"4eabac9","metric":4670714,"status":"discard","description":"8MB BufferedOutputStream: 5% slower, cache pressure","metrics":{},"timestamp":1773553278}
{"commit":"4eabac9","metric":4786979,"status":"discard","description":"cached date computation in timestamp: within noise","metrics":{},"timestamp":1773553348}
{"commit":"4eabac9","metric":4887585,"status":"discard","description":"fast minute from hour:minute + fixed comma offsets: within noise","metrics":{},"timestamp":1773553436}
{"commit":"4eabac9","metric":4823926,"status":"discard","description":"FileChannel output: no improvement","metrics":{},"timestamp":1773553495}
{"commit":"4eabac9","metric":4791566,"status":"discard","description":"skip-ahead newline scan + fixed comma offsets: within noise","metrics":{},"timestamp":1773553542}
{"commit":"4eabac9","metric":4861448,"status":"discard","description":"pipelined emit: no improvement, already overlapping","metrics":{},"timestamp":1773553599}
{"commit":"4eabac9","metric":4870920,"status":"discard","description":"direct append (no sb2): within noise","metrics":{},"timestamp":1773553647}
{"commit":"4eabac9","metric":4918839,"status":"discard","description":"pre-computed timestamp prefixes: within noise (5-run confirmation)","metrics":{},"timestamp":1773553721}
{"commit":"4eabac9","metric":4789272,"status":"discard","description":"nThreads/2 chunks: no improvement, reduced parse parallelism","metrics":{},"timestamp":1773553789}
{"commit":"4eabac9","metric":5010020,"status":"keep","description":"bundled emit: pre-computed prefixes + direct append, no sb2 (5010020 ev/s, +1.7%)","metrics":{},"timestamp":1773553858}
{"commit":"acef103","metric":4812319,"status":"discard","description":"bounded minute range: negligible savings (~60 empty slots)","metrics":{},"timestamp":1773553984}
{"commit":"acef103","metric":4750593,"status":"discard","description":"fused merge+emit: 5% worse, poor cross-partition cache locality","metrics":{},"timestamp":1773554094}
{"commit":"dcd3aac","metric":5157297,"status":"keep","description":"data layout transposition [sensor][minute] → [minute][sensor] for cache-friendly parse","metrics":{},"timestamp":1773554354}
{"commit":"17deadc","metric":4887585,"status":"discard","description":"SlidingState initial array 64→8: resize overhead > memory savings (-5.2%)","metrics":{},"timestamp":1773554453}
{"commit":"17deadc","metric":4899559,"status":"discard","description":"SlidingState initial array 64→16: still regresses (-5%), high GC variance","metrics":{},"timestamp":1773554481}
{"commit":"17deadc","metric":5293806,"status":"keep","description":"lazy sliding windows: 1 raw write per event instead of 5, combine at merge time (+2.6%)","metrics":{},"timestamp":1773554715}
{"commit":"2d8ae0a","metric":5243838,"status":"discard","description":"SoA tumbling (primitive arrays): Arrays.fill init overhead, no improvement","metrics":{},"timestamp":1773555256}
{"commit":"2d8ae0a","metric":5302226,"status":"discard","description":"direct minute-index + merged if: within noise, JIT already optimizes","metrics":{},"timestamp":1773555386}
{"commit":"2d8ae0a","metric":5743825,"status":"keep","description":"direct byte[] emit: eliminate StringBuilder→String→byte[] triple copy (+8.5%)","metrics":{},"timestamp":1773555636}
{"commit":"ba2c70e","metric":5753739,"status":"discard","description":"digit-pair appendLongBytes: within noise, JIT handles division chains","metrics":{},"timestamp":1773555946}
{"commit":"ba2c70e","metric":5617977,"status":"discard","description":"bypass BufferedOutputStream: regression, batching helps pipe writes","metrics":{},"timestamp":1773556023}
{"commit":"ba2c70e","metric":5824111,"status":"keep","description":"experiment: merged bounds-check in processChunk — single if block for tumbling+sliding (5824111 ev/s, +1.4%)","metrics":{},"timestamp":1773581449}
{"commit":"0f97e53","metric":5885815,"status":"keep","description":"experiment: hardcoded c1=lineStart+20, scan c2 from c1+8 — skip comma search loop (5885815 ev/s, +1.1%)","metrics":{},"timestamp":1773581650}
{"commit":"0113597","metric":5966587,"status":"keep","description":"experiment: branchless c2 — chained if/else for sensor digit count, no scan loop (5966587 ev/s, +1.4%)","metrics":{},"timestamp":1773581683}
{"commit":"317e674","metric":5672149,"status":"discard","description":"experiment: fused c2+sIdx parse with nested branching — JIT regression (5672149 ev/s, -4.9%)","metrics":{},"timestamp":1773581729}
{"commit":"317e674","metric":4570383,"status":"discard","description":"experiment: single bulk read + parallel parse — 388MB allocation GC pressure (4570383 ev/s, -23.4%)","metrics":{},"timestamp":1773581838}
{"commit":"317e674","metric":6016847,"status":"keep","description":"experiment: bounded merge loops by active minute range per partition (6016847 ev/s, +0.8%)","metrics":{},"timestamp":1773582083}
{"commit":"e16e317","metric":6257822,"status":"keep","description":"experiment: single-pass merge — tumbling+sliding fused in one partition/minute loop (6257822 ev/s, +4.0%)","metrics":{},"timestamp":1773582168}
{"commit":"7c9fb83","metric":6447453,"status":"keep","description":"experiment: transpose merged data to [minute][sensor] layout — cache-friendly emit (6447453 ev/s, +3.0%)","metrics":{},"timestamp":1773582320}
{"commit":"8882905","metric":6226650,"status":"discard","description":"experiment: direct tumbling merge to output layout — scattered writes cause cache misses (6226650 ev/s, -3.4%)","metrics":{},"timestamp":1773583092}
{"commit":"8882905","metric":6086427,"status":"discard","description":"experiment: active-range-only allocation and emit — dynamic bounds overhead (6086427 ev/s, -5.6%)","metrics":{},"timestamp":1773583146}
{"commit":"8882905","metric":6020469,"status":"discard","description":"experiment: reuse per-sensor temp arrays with Arrays.fill — fill slower than TLAB alloc (6020469 ev/s, -6.6%)","metrics":{},"timestamp":1773583203}
{"commit":"8882905","metric":5537098,"status":"discard","description":"experiment: Arrays.sort instead of dual quickselect — O(n log n) slower than O(n) (5537098 ev/s, -14.1%)","metrics":{},"timestamp":1773583265}
{"commit":"8882905","metric":5959475,"status":"discard","description":"experiment: two-phase merge (minute-parallel raw + sensor-parallel pcts) — barrier overhead (5959475 ev/s, -7.6%)","metrics":{},"timestamp":1773583385}
{"commit":"8882905","metric":6246096,"status":"discard","description":"experiment: eliminate newline scan, inline double parse — breaks JIT vectorization (6246096 ev/s, -3.1%)","metrics":{},"timestamp":1773583572}
{"commit":"8882905","metric":5970149,"status":"discard","description":"experiment: cache date→minute offset, parse only HH:MM — comparison overhead exceeds savings (5970149 ev/s, -7.4%)","metrics":{},"timestamp":1773583750}
{"commit":"8882905","metric":6439150,"status":"discard","description":"experiment: ForkJoinPool.commonPool() — nCPU-1 threads offset startup savings (6439150 ev/s, ~0%)","metrics":{},"timestamp":1773583898}
{"commit":"8882905","metric":6188118,"status":"discard","description":"experiment: virtual threads — scheduling overhead for CPU-bound work (6188118 ev/s, -4.0%)","metrics":{},"timestamp":1773583942}
{"commit":"8882905","metric":5844535,"status":"discard","description":"experiment: 6 threads — insufficient parallelism (5844535 ev/s, -9.4%)","metrics":{},"timestamp":1773584023}
{"commit":"8882905","metric":6119951,"status":"discard","description":"experiment: 32-bit division for minute index — JIT already uses multiply-by-reciprocal (6119951 ev/s, -5.1%)","metrics":{},"timestamp":1773584130}
{"commit":"8882905","metric":5906674,"status":"discard","description":"experiment: bypass System.out with FileDescriptor.out — pipe buffer contention (5906674 ev/s, -8.4%)","metrics":{},"timestamp":1773584172}
{"commit":"8882905","metric":5546311,"status":"discard","description":"experiment: concat emit chunks before writing — 166MB extra allocation GC pressure (5546311 ev/s, -14.0%)","metrics":{},"timestamp":1773584216}
{"commit":"4b2ec2c","metric":6720430,"status":"keep","description":"experiment: merge SlidingState into TumblingState — unified state eliminates redundant array dereferences (6720430 ev/s, +4.2%)","metrics":{},"timestamp":1773585192}
{"commit":"2056fbd","metric":7283321,"status":"keep","description":"experiment: integer percentile indices + zero-copy emit buffers — eliminate Math.ceil and 168MB trim copies (7283321 ev/s, +8.4%)","metrics":{},"timestamp":1773585441}
{"commit":"b5678ac","metric":7668711,"status":"keep","description":"experiment: mmap file reading — kernel readahead beats channel.read for parse I/O (7668711 ev/s, +5.3%)","metrics":{},"timestamp":1773585632}
{"commit":"b5678ac","metric":7107320,"status":"discard","description":"experiment: combined sliding+tumbling emit per task — larger working set hurts cache (7107320 ev/s, -7.3%)","metrics":{},"timestamp":1773585884}
{"commit":"b5678ac","metric":7299270,"status":"discard","description":"experiment: flat slidingP50/P99 arrays with NaN sentinel — Arrays.fill(NaN) + isNaN overhead outweighs savings (7299270 ev/s, -4.8%)","metrics":{},"timestamp":1773585956}
{"commit":"b5678ac","metric":6756756,"status":"discard","description":"experiment: single mmap + shared data array — 388MB allocation GC pressure (6756756 ev/s, -11.9%)","metrics":{},"timestamp":1773586022}
{"commit":"04e873d","metric":7898894,"status":"keep","description":"experiment: skip 31 bytes before newline scan — known minimum line length avoids scanning fixed-format prefix (7898894 ev/s, +3.0%)","metrics":{},"timestamp":1773586129}
{"commit":"6e8add8","metric":8244023,"status":"keep","description":"experiment: fast minute computation — precompute day offset, parse only HH:MM per event (8244023 ev/s, +4.4%)","metrics":{},"timestamp":1773586284}
{"commit":"6e8add8","metric":8221172,"status":"discard","description":"experiment: int-scaled raw values (value*100) — Math.round per-event overhead offsets halved arraycopy (8221172 ev/s, -0.3%)","metrics":{},"timestamp":1773586599}
{"commit":"6e8add8","metric":7861635,"status":"discard","description":"experiment: direct merge into output layout — worse cache locality from (partition,minute,sensor) loop order (7861635 ev/s, -4.6%)","metrics":{},"timestamp":1773586697}
{"commit":"6e8add8","metric":7818608,"status":"discard","description":"experiment: optimized double parser — constant multiplier not faster than JIT-optimized div loop (7818608 ev/s, -5.2%)","metrics":{},"timestamp":1773586812}
{"commit":"6e8add8","metric":7593014,"status":"discard","description":"experiment: smaller initial values array [4] — resize copies offset allocation savings (7593014 ev/s, -7.9%)","metrics":{},"timestamp":1773586898}
{"commit":"6e8add8","metric":7782101,"status":"discard","description":"experiment: p99=max special case — branch overhead + lost partial partitioning for p50 (7782101 ev/s, -5.6%)","metrics":{},"timestamp":1773586986}
{"commit":"6e8add8","metric":8291873,"status":"discard","description":"experiment: 4MB output buffer — negligible syscall reduction for 166MB output (+0.6%, noise)","metrics":{},"timestamp":1773587262}
{"commit":"6e8add8","metric":7806401,"status":"discard","description":"experiment: Arrays.sort replaces quickselect — full sort O(n log n) slower than two-call quickselect with partial partition reuse (-5.3%)","metrics":{},"timestamp":1773587531}
{"commit":"6e8add8","metric":7861635,"status":"discard","description":"experiment: pre-compute avg + inline newline + reuse merged[] — clearing loop overhead offsets micro-gains (-4.6%)","metrics":{},"timestamp":1773588034}
{"commit":"6e8add8","metric":8244023,"status":"discard","description":"experiment: inline newline suffix as direct byte writes — arraycopy overhead for 5 bytes is negligible (+0.0%, noise)","metrics":{},"timestamp":1773588097}
{"commit":"c003ffa","metric":8536103,"status":"keep","description":"experiment: eliminate slidingPcts — compute percentiles inline during emit (8536103 ev/s, +3.5%)","metrics":{},"timestamp":1773588265}
{"commit":"c003ffa","metric":8517887,"status":"discard","description":"experiment: unroll 5-minute sliding k-loop — JIT already optimizes the loop, manual unrolling adds code bloat (-0.2%, noise)","metrics":{},"timestamp":1773588527}
{"commit":"573a2f5","metric":9154010,"status":"keep","description":"experiment: direct mmap parsing via Unsafe — eliminate 384MB heap copy (9154010 ev/s, +7.2%)","metrics":{},"timestamp":1773588927}
{"commit":"573a2f5","metric":8257638,"status":"discard","description":"experiment: minute-range merge parallelism — direct mergedTumbling writes cause cache thrashing vs sensor-range with temp array (-9.8%)","metrics":{},"timestamp":1773589184}
{"commit":"573a2f5","metric":7949125,"status":"discard","description":"experiment: fused sliding+tumbling emit — per-task working set too large, cache thrashing (-13.2%)","metrics":{},"timestamp":1773589337}
{"commit":"573a2f5","metric":8847763,"status":"discard","description":"experiment: remove median-of-3 pivot in quickselect — worse pivot quality increases iteration count (-3.3%)","metrics":{},"timestamp":1773589415}
{"commit":"573a2f5","metric":9099181,"status":"discard","description":"experiment: hardcode c2=c1+12 + unrolled 4-digit sensor index — eliminates 3 branch checks but JIT already predicts the pattern (-0.6%, noise)","metrics":{},"timestamp":1773590130}
{"commit":"573a2f5","metric":7374631,"status":"discard","description":"experiment: insertion sort for small sliding windows (N≤32) — O(N²) comparisons worse than two quickselect calls with partial partition reuse (-19.4%)","metrics":{},"timestamp":1773590193}
{"commit":"573a2f5","metric":8347245,"status":"discard","description":"experiment: merge directly into mergedTumbling (no temp array) — cache contention between threads on shared rows, same failure as minute-range merge (-8.8%)","metrics":{},"timestamp":1773590233}
{"commit":"573a2f5","metric":8960573,"status":"discard","description":"experiment: eliminate newline scan + inline value parse — high variance (8.5-10.5M), 5-run median below baseline, JIT inconsistency with inline parse (-2.1%)","metrics":{},"timestamp":1773590422}
