{"commit":"573a2f5","metric":9216589,"status":"keep","description":"experiment: single file-wide mmap shared across all threads — 1 syscall vs 12, reduced TLB pressure, simpler code (9216589 ev/s, +0.7%)","metrics":{},"timestamp":1773590560}
{"commit":"4928a3e","metric":8802816,"status":"discard","description":"experiment: write tumbling output first — output I/O evicts cache lines sliding still reads (-4.5%)","metrics":{},"timestamp":1773590683}
{"commit":"4928a3e","metric":8787346,"status":"discard","description":"experiment: 4MB output buffer — larger buffer evicts cache, negates reduced syscalls (-4.7%)","metrics":{},"timestamp":1773590714}
{"commit":"4928a3e","metric":7429420,"status":"discard","description":"experiment: fused merge+sliding with sensor-range parallelism — sliding reads ALL minutes per sensor causing poor cache locality vs minute-range (-19.4%)","metrics":{},"timestamp":1773591109}
{"commit":"4928a3e","metric":6887052,"status":"discard","description":"experiment: pre-sort values during merge — O(n log n) sort overhead per minute far exceeds quickselect savings (-25%)","metrics":{},"timestamp":1773591309}
{"commit":"7bbb1f7","metric":9157509,"status":"discard","description":"experiment: per-line bulk read into local byte[48] — 1 MBB bulk read replaces ~13 individual get() calls but bulk overhead offsets savings (-1.5%)","metrics":{},"timestamp":1773596027}
{"commit":"7bbb1f7","metric":7352941,"status":"discard","description":"experiment: GraalVM CE/Oracle 21 — Graal JIT doesn't optimize MBB.get() as well as HotSpot C2, both 20-30% slower","metrics":{},"timestamp":1773596142}
{"commit":"7bbb1f7","metric":9124087,"status":"discard","description":"experiment: hybrid bulk prefix read — mbb.get(pos,buf,0,33) for fixed prefix + individual get for value. Bulk overhead offsets savings (-2%)","metrics":{},"timestamp":1773596291}
{"commit":"7bbb1f7","metric":9090909,"status":"discard","description":"experiment: cumulative size table for fast sliding window skip — 6MB int[sc][gMax+2] array adds cache pressure, precomputation overhead exceeds savings (-2.7%)","metrics":{},"timestamp":1773596410}
{"commit":"7bbb1f7","metric":8271298,"status":"discard","description":"experiment: 6 emit threads instead of 12 — less parallelism hurts more than cache reuse helps, emit is CPU-bound (-11%)","metrics":{},"timestamp":1773596498}
{"commit":"7bbb1f7","metric":9041591,"status":"discard","description":"experiment: sensor-range sliding emit with contiguous value tape — 1 contiguous copy vs 5 scattered, but tape building overhead (10M extra copies) and sensor-range cache pressure offsets locality gains (-3.3%)","metrics":{},"timestamp":1773597609}
{"commit":"7bbb1f7","metric":9174311,"status":"discard","description":"experiment: sliding emit loop reorder — sensor-outer, minute-inner for TumblingState temporal reuse across consecutive sliding windows. Row spatial locality regression outweighs TS cache benefit (-1.8%)","metrics":{},"timestamp":1773597972}
{"commit":"a71ac6f","metric":9784735,"status":"keep","description":"experiment: JVM JIT tuning — -XX:-TieredCompilation (skip C1, C2-only) + -XX:+AlwaysCompileLoopMethods via jvm.opts (+4.7%)","metrics":{},"timestamp":1773598336}
{"commit":"9c9d02a","metric":9624639,"status":"discard","description":"experiment: adding aggressive inlining flags (MaxInlineLevel=15, InlineSmallCode=2000, FreqInlineSize=500) to C2-only — code bloat hurts icache, worse than C2-only alone (-1.6%)","metrics":{},"timestamp":1773598404}
{"commit":"9c9d02a","metric":9765625,"status":"discard","description":"experiment: LoopUnrollLimit=120 on C2-only — no measurable effect, noise","metrics":{},"timestamp":1773598454}
{"commit":"9c9d02a","metric":9718172,"status":"discard","description":"experiment: MAX_SENSORS=1000 (exact count vs 1100) — 800 bytes smaller per TumblingState[] row, but no measurable cache benefit (-0.7%)","metrics":{},"timestamp":1773598552}
{"commit":"9c9d02a","metric":9980039,"status":"keep","description":"experiment: specialized double parser — exploit known format (exactly 2 decimal places), dispatch by dot position instead of loops. Eliminates loop overhead, reduces branch mispredictions (9980039 ev/s, +2.0%)","metrics":{},"timestamp":1773598671}
{"commit":"96ee090","metric":9727626,"status":"discard","description":"experiment: batch getLong/getInt for timestamp+sensor — C2 already eliminates bounds checks via range check elimination, extra shift/mask ALU overhead cancels savings (-2.5%)","metrics":{},"timestamp":1773598780}
{"commit":"96ee090","metric":8149959,"status":"discard","description":"experiment: MemorySegment (FFM API) replacing MappedByteBuffer — segment validity + scope checks add MORE overhead per byte read than MBB's bounds check. -18.3%, abandon this direction","metrics":{},"timestamp":1773599034}
{"commit":"96ee090","metric":10493179,"status":"keep","description":"experiment: eliminate newline scan — compute line length from value format. Known fixed layout (20+1+11+1+value+1) lets us advance pos directly after parsing the value, saving ~7 mbb.get() calls/line (10493179 ev/s, +5.1%)","metrics":{},"timestamp":1773599707}
{"commit":"80a2f6c","metric":10741138,"status":"keep","description":"experiment: int[] values for percentile quickselect — halve memory per value (4B vs 8B), faster arraycopy, integer quickselect. Compute scaled int directly from parsed digits, format output via appendScaledInt (10741138 ev/s, +2.4%)","metrics":{},"timestamp":1773600195}
{"commit":"3adab45","metric":10835443,"status":"discard","description":"inline suffix + sensor comma — regression 3+/5-","metrics":{},"timestamp":1773615194}
{"commit":"1010266","metric":11098779,"status":"discard","description":"4KB block buffer for parse: read 4KB from MBB instead of 48 bytes/line — no improvement, per-line MBB.get() bounds check already fast with C2 JIT range check elimination","metrics":{},"timestamp":1773617635}
{"commit":"1010266","metric":11198208,"status":"discard","description":"heap pre-sizing -Xmx2g -Xms2g — no improvement, GC already efficient at default heap size","metrics":{},"timestamp":1773617990}
{"commit":"1010266","metric":10989010,"status":"discard","description":"CompileThreshold=100 (faster C2 compilation) — no improvement, A/B shows +0.3% which is noise","metrics":{},"timestamp":1773618196}
{"commit":"1010266","metric":8992805,"status":"discard","description":"incremental sliding window with sorted array — -20% regression. Per-sensor state maintenance (sort 6 rmVals + merge-scan + sort 6 addVals + merge) exceeds quickselect cost for N≈30","metrics":{},"timestamp":1773618397}
{"commit":"1010266","metric":11210762,"status":"discard","description":"UseTransparentHugePages JVM flag — no improvement, THP already enabled system-wide (always mode)","metrics":{},"timestamp":1773618435}
{"commit":"1010266","metric":10330578,"status":"discard","description":"ShenandoahGC — -8.3% regression, concurrent barrier overhead exceeds GC pause reduction for short-lived process","metrics":{},"timestamp":1773618599}
{"commit":"1010266","metric":11441647,"status":"keep","description":"skip sensor name String allocation — eliminate 8.8KB sensorNames[] from parse hot path, generate names from indices. Frees L1d cache + removes null check branch + eliminates 12K String allocations (A/B +4.7%)","metrics":{},"timestamp":1773618760}
